{
  "$schema": "https://json-schema.org/draft/2020-12/schema",
  "$id": "https://faultline.invalid/contracts/job.schema.json",
  "title": "Faultline job",
  "type": "object",
  "additionalProperties": false,
  "properties": {
    "schema_version": {
      "const": 1
    },
    "id": {
      "type": "string",
      "pattern": "^[A-Za-z0-9][A-Za-z0-9:_-]{0,127}$"
    },
    "workspace_id": {
      "type": "string",
      "pattern": "^[A-Za-z0-9][A-Za-z0-9:_-]{0,127}$"
    },
    "case_id": {
      "anyOf": [
        {
          "type": "string",
          "pattern": "^[A-Za-z0-9][A-Za-z0-9:_-]{0,127}$"
        },
        {
          "type": "null"
        }
      ]
    },
    "kind": {
      "type": "string",
      "enum": [
        "import",
        "capture",
        "metric",
        "hypotheses",
        "analytic_test",
        "browser_test",
        "diagnosis",
        "export",
        "follow_up",
        "retention"
      ]
    },
    "status": {
      "type": "string",
      "enum": [
        "queued",
        "running",
        "waiting_for_input",
        "cancel_requested",
        "cancelled",
        "succeeded",
        "failed"
      ]
    },
    "progress_completed": {
      "type": "integer",
      "minimum": 0,
      "maximum": 9007199254740991
    },
    "progress_total": {
      "anyOf": [
        {
          "type": "integer",
          "minimum": 0,
          "maximum": 9007199254740991
        },
        {
          "type": "null"
        }
      ]
    },
    "input_hash": {
      "type": "string",
      "pattern": "^[a-f0-9]{64}$"
    },
    "attempt": {
      "type": "integer",
      "minimum": 1,
      "maximum": 10
    },
    "created_at": {
      "type": "string",
      "format": "date-time",
      "pattern": "^\\d{4}-\\d{2}-\\d{2}T\\d{2}:\\d{2}:\\d{2}\\.\\d{3}Z$"
    },
    "updated_at": {
      "type": "string",
      "format": "date-time",
      "pattern": "^\\d{4}-\\d{2}-\\d{2}T\\d{2}:\\d{2}:\\d{2}\\.\\d{3}Z$"
    },
    "waiting_reason": {
      "anyOf": [
        {
          "type": "string",
          "minLength": 1,
          "maxLength": 100
        },
        {
          "type": "null"
        }
      ]
    },
    "result_ref": {
      "anyOf": [
        {
          "type": "string",
          "pattern": "^[A-Za-z0-9][A-Za-z0-9:_-]{0,127}$"
        },
        {
          "type": "null"
        }
      ]
    },
    "error_code": {
      "anyOf": [
        {
          "type": "string",
          "minLength": 1,
          "maxLength": 100
        },
        {
          "type": "null"
        }
      ]
    }
  },
  "required": [
    "schema_version",
    "id",
    "workspace_id",
    "case_id",
    "kind",
    "status",
    "progress_completed",
    "progress_total",
    "input_hash",
    "attempt",
    "created_at",
    "updated_at",
    "waiting_reason",
    "result_ref",
    "error_code"
  ]
}
